<?xml version="1.0"?>
<reminders xmlns:xsi="http://www.w3.org/2001/XMLSchema-instance" xsi:noNamespaceSchemaLocation="remind.xsd">
	<event id="e20040119215731"><date type="yearly" yearly="wday" offset="# -2" duration="3" duration-view="mag" pending="5">06 2 1</date><category>motorcycle</category><category>rally</category><category>email2</category><category>external</category><style>RmdMotorcycle</style><subject><![CDATA[http://www.lynchburgmotorcyclerally.com/ [Lynchburg Motorcycle Rally]]]></subject></event><event id="e20040120142334"><date type="yearly" yearly="wday" pending="5">09 2 1</date><category>motorcycle</category><category>charity</category><category>rally</category><category>ride</category><category>email</category><category>external</category><style>RmdMotorcycle</style><subject><![CDATA[http://www.ride4kids.org/ [Ride for Kids]]]></subject><content><![CDATA[Birmingham, AL]]></content></event><event id="e20050906220724"><date type="yearly" yearly="wday">06 1 7</date><category>charity</category><category>external</category><category>email2</category><style>RmdMotorcycleLocal</style><subject><![CDATA[http://www.goodsamaritanride.com/ [Good Samaritan Ride]]]></subject></event><event id="e20060417233939"><date type="yearly" yearly="wday" pending="5">06 2 7</date><category>external</category><category>charity</category><category>email</category><category>motorcycle</category><style>RmdMotorcycle</style><subject><![CDATA[http://www.campsam.org/ [Camp Smile-A-Mile] Motorcycle Ride]]></subject><content><![CDATA[Birmingham]]></content></event><event id="e20080329094011"><date type="yearly" yearly="wday">04 3 7</date><category>charity</category><category>email</category><category>external</category><style>RmdCharityInfo</style><subject><![CDATA[http://www.RiverCityThunderRally.com/ [River City Thunder Rally]]]></subject><content><![CDATA[Benefit for Morgan County Child Advocacy Center]]></content></event></reminders>
