<?xml version="1.0"?>
<reminders xmlns:xsi="http://www.w3.org/2001/XMLSchema-instance" xsi:noNamespaceSchemaLocation="remind.xsd">
	<event id="e20051206215638"><date type="yearly" yearly="wday" time="18:30">12 2 7</date><category>al-x</category><category>x-gathering</category><category>meeting</category><category>supper</category><category>party</category><category>email</category><category>x-meeting</category><category>funday</category><style>RmdGathering</style><subject><![CDATA[Your Chapter Christmas Party]]></subject><content><![CDATA[address:108-C+1st+Street+South,+Alabaster,+AL [Restaurant Name], Brief Directions, 6:30pm. Don't forget your Dirty Santa gift ]]></content></event><event id="e20050521233813"><date type="yearly" yearly="dayn">01 04</date><category>birthday</category><category>email2</category><category>newsletter</category><style>birthday</style><subject><![CDATA[Your Chapter]]></subject><content><![CDATA[Charter {{year 1983}} Anniversary]]></content></event><event id="e20081212163322"><date type="monthly" monthly="wday" time="18:30" offset="? m12 ++ cancel">1 1 2 4</date><category>al-x</category><category>x-gathering</category><category>x-meeting</category><category>meeting</category><category>email</category><category>supper</category><style>RmdGathering</style><subject><![CDATA[Your Chapter gathering]]></subject><content><![CDATA[address:108-C+1st+Street+South,+Alabaster,+AL [Restaurant Name], Brief Directions, Eat 6:30pm / Meet 7:30pm]]></content></event></reminders>
