<?xml version="1.0"?>
<reminders 
	xmlns:xsi="http://www.w3.org/2001/XMLSchema-instance" 
	xsi:noNamespaceSchemaLocation="remind.xsd">
	<event id="e20080206230456"><date type="single">2008 09 13</date><category>safety</category><category>external</category><category>email2</category><style>RmdSafetyInfo</style><subject><![CDATA[http://www.montevallo.edu/atsc/motorcycle/ [Experienced Rider Course]]]></subject><content><![CDATA[address:358+Bolling+Road,+Meridianville,+AL+35759 [Madison County Executive Airport]]]></content></event><event id="e20080206231444"><date type="single">2008 11 22</date><category>safety</category><category>external</category><category>email2</category><style>RmdSafetyInfo</style><subject><![CDATA[http://www.montevallo.edu/atsc/motorcycle/ [Experienced Rider Course]]]></subject><content><![CDATA[address:358+Bolling+Road,+Meridianville,+AL+35759 [Madison County Executive Airport]]]></content></event><event id="e20080805164356"><date type="single">2008 10 04</date><category>safety</category><category>external</category><category>email2</category><style>RmdSafetyInfo</style><subject><![CDATA[http://www.montevallo.edu/atsc/motorcycle/ [Experienced Rider Course]]]></subject><content><![CDATA[address:358+Bolling+Road,+Meridianville,+AL+35759 [Madison County Executive Airport]]]></content></event></reminders>
